{
  "id": "hr-fetch-active-employee-salaries",
  "name": "Fetch active employee salary records",
  "description": "Retrieve all active employee salary records for a given period, return as JSON array",
  "task": "FETCH",
  "dom": "HR",
  "packet": "FETCH|HR|return:HR-Agent|p:1|aacp:1.1|res:emp_salary|filter:status=active|fmt:json",
  "tags": [
    "payroll",
    "salary",
    "employees",
    "monthly"
  ],
  "version": "1.1",
  "source": "community",
  "validated": true
}