{
  "id": "mkt-proc-content-approval",
  "name": "Route content for approval",
  "description": "Route marketing content through legal and brand approval workflow before publication",
  "task": "PROC",
  "dom": "MKT",
  "packet": "PROC|MKT|return:MKT-Agent|p:2|aacp:1.4|res:content_approval|req:legal_review,brand_review",
  "tags": [
    "content",
    "approval",
    "legal",
    "brand"
  ],
  "version": "1.1",
  "source": "community",
  "validated": true
}
