{
  "id": "sales-merge-pipeline-forecast",
  "name": "Merge pipeline and forecast data",
  "description": "Merge CRM pipeline data with sales forecast for unified revenue view",
  "task": "MERGE",
  "dom": "SALES",
  "packet": "MERGE|SALES|return:SALES-Agent|p:2|aacp:1.4|res:pipeline_forecast_merged|rules:forecast_v1|validate:period_match",
  "tags": [
    "pipeline",
    "forecast",
    "merge",
    "sales"
  ],
  "version": "1.1",
  "source": "community",
  "validated": true
}
