{
  "id": "it-proc-change-request",
  "name": "Process IT change request",
  "description": "Process and route IT change request through CAB approval process",
  "task": "PROC",
  "dom": "IT",
  "packet": "PROC|IT|return:IT-Agent|p:2|aacp:1.4|res:change_request|req:risk_assessment,cab_approval",
  "tags": [
    "change",
    "cab",
    "approval",
    "itsm"
  ],
  "version": "1.1",
  "source": "community",
  "validated": true
}
